title,release_date,genre,director,actors,duration,imdb_id,country,budget,box_office,awards,set_in_period,year,wikipedia_url
Out and Out Rout,1966-01-29T00:00:00Z,,"Rudy Larriva (male, United States)",,,,United States,,,,,1966,
"Jerry, Jerry, Quite Contrary",1966-01-01T00:00:00Z,,"Chuck Jones (male, Japan)",,6,tt0060557,United States,,,,,1966,"https://en.wikipedia.org/wiki/Jerry,_Jerry,_Quite_Contrary"
Snow Excuse,1966-01-01T00:00:00Z,,"Robert McKimson (male, United States)",,,tt0060995,United States,,,,,1966,https://en.wikipedia.org/wiki/Snow_Excuse
The Astroduck,1966-01-01T00:00:00Z,comedy film,"Robert McKimson (male, United States)",,,tt0060136,United States,,,,,1966,https://en.wikipedia.org/wiki/The_Astroduck
Swing Ding Amigo,1966-01-01T00:00:00Z,,"Robert McKimson (male, United States)",,7,tt0061051,United States,,,,,1966,https://en.wikipedia.org/wiki/Swing_Ding_Amigo
Clippety Clobbered,1966-03-12T00:00:00Z,,"Rudy Larriva (male, United States)",,,tt0060244,United States,,,,,1966,https://en.wikipedia.org/wiki/Clippety_Clobbered
Chromophobia,1966-01-01T00:00:00Z,,"Raoul Servais (male, Belgium)",,10,tt0208049,Belgium,,,,,1966,
Sugar and Spies,1966-01-01T00:00:00Z,,"Robert McKimson (male, United States)",,,tt0061041,United States,,,,,1966,https://en.wikipedia.org/wiki/Sugar_and_Spies
Agent 077: From the Orient with Fury,1966-08-04T00:00:00Z,"parody film, spy film","Sergio Grieco (male, Kingdom of Italy)","Ennio Balbo (male, Kingdom of Italy), Fernando Sancho (male, Spain)",94,tt0058881,Spain,,,,,1966,https://en.wikipedia.org/wiki/Agent_077:_From_the_Orient_with_Fury
Esperanza,1967-01-01T00:00:00Z,"experimental film, psychedelic film","Ivan Andonov (male, Kingdom of Bulgaria)",,8,tt0169875,People's Republic of Bulgaria,,,,,1967,
Passion of Spies,1967-01-01T00:00:00Z,"detective fiction, parody film","Yefim Gamburg (male, Russia)",,21,tt0487763,Soviet Union,,,,,1967,https://en.wikipedia.org/wiki/Passion_of_Spies
"Hello, Goodbye",1967-11-26T00:00:00Z,,"Paul McCartney (male, United Kingdom)",,,tt7882330,United Kingdom,,,,,1967,
Q4388178,1967-01-01T00:00:00Z,,"Vladimir Polkovnikov (male, Russian Empire)",,,tt6789898,Soviet Union,,,,,1967,
Alter Egotist,1967-04-01T00:00:00Z,"comedy film, fantasy film",,,6,tt0149636,United States,,,,,1967,
The Mitten,1967-06-05T00:00:00Z,"children's film, family film, fantasy film","Roman Kachanov (male, Soviet Union)",,10,tt0393932,Soviet Union,,,,,1967,https://en.wikipedia.org/wiki/The_Mitten_(film)
Cool Cat,1967-01-01T00:00:00Z,,"Alex Lovy (male, United States)",,6,tt0061511,United States,,,,,1967,https://en.wikipedia.org/wiki/Cool_Cat_(film)
High but Not Dry,1967-08-01T00:00:00Z,"apocalyptic film, comedy film, fantasy film",,,6,tt0150911,United States,,,,,1967,
The locomotive from Romashkov,1967-01-01T00:00:00Z,cinematic fairy tale,"Vladimir Degtyaryov (male, Soviet Union)",,,tt3440260,Soviet Union,,,,,1967,
What on Earth!,1967-01-01T00:00:00Z,"comedy film, mockumentary, science fiction comedy, science fiction film","Kaj Pindal (male, Kingdom of Denmark), Les Drew (male, Canada)",,10,tt0062353,Canada,,,,,1967,https://en.wikipedia.org/wiki/What_on_Earth!_(film)
Cannery Rodent,1967-01-01T00:00:00Z,,"Chuck Jones (male, Japan)",,6,tt0061444,United States,,,,,1967,https://en.wikipedia.org/wiki/Cannery_Rodent
Clean Sweep,1967-06-01T00:00:00Z,"comedy film, fantasy film",,,7,tt0150144,United States,,,,,1967,
Guided Mouse-ille,1967-01-01T00:00:00Z,science fiction film,"Abe Levitow (male, United States)",,6,tt0061737,United States,,,,,1967,https://en.wikipedia.org/wiki/Guided_Mouse-ille
Hot Diggity Dog,1967-01-01T00:00:00Z,,"Paul J. Smith (male, United States)",,,tt0150958,United States,,,,,1967,
Merlin the Magic Mouse,1967-01-01T00:00:00Z,,"Alex Lovy (male, United States)",,,tt0061966,United States,,,,,1967,https://en.wikipedia.org/wiki/Merlin_the_Magic_Mouse_(film)
Breath,1967-01-01T00:00:00Z,,"Jimmy Murakami (male, United States)",,4,tt0475527,United States,,,Annecy Cristal for a Short Film,,1967,
Advance and Be Mechanized,1967-01-01T00:00:00Z,,"Ben Washam (male, United States)",,6,tt0061332,United States,,,,,1967,https://en.wikipedia.org/wiki/Advance_and_Be_Mechanized
O-Solar Meow,1967-02-24T00:00:00Z,science fiction film,"Abe Levitow (male, United States)",,6,tt0062061,United States,,,,,1967,https://en.wikipedia.org/wiki/O-Solar_Meow
Surf-Bored Cat,1967-05-05T00:00:00Z,,"Abe Levitow (male, United States)",,6,tt0062321,United States,,,,,1967,https://en.wikipedia.org/wiki/Surf-Bored_Cat
Brother Bat,1967-08-01T00:00:00Z,"comedy film, fantasy film",,,6,tt0149967,United States,,,,,1967,
Hamlet,1967-01-01T00:00:00Z,,"György Kovásznai (male, Hungary)",,,,Hungary,,,,,1967,
Cat and Dupli-cat,1967-01-01T00:00:00Z,musical film,"Chuck Jones (male, Japan)",,6,tt0061455,United States,,,,,1967,https://en.wikipedia.org/wiki/Cat_and_Dupli-cat
Speedy Ghost to Town,1967-01-01T00:00:00Z,,"Alex Lovy (male, United States)",,,tt0062297,United States,,,,,1967,https://en.wikipedia.org/wiki/Speedy_Ghost_to_Town
Rodent to Stardom,1967-01-01T00:00:00Z,,"Alex Lovy (male, United States)",,,tt0062210,United States,,,,,1967,https://en.wikipedia.org/wiki/Rodent_to_Stardom
Hyokkori Hyōtanjima,1967-07-21T00:00:00Z,,"Taiji Yabushita (male, Empire of Japan)",,,tt0061797,Japan,,,,,1967,
František,1967-01-01T00:00:00Z,fairy tale,"Vadim Vladimirovitch Kurchevsky (male, Soviet Union)",,,tt9297860,Soviet Union,,,,,1967,
Go Away Stowaway,1967-01-01T00:00:00Z,,"Alex Lovy (male, United States)",,,tt0061716,United States,,,,,1967,https://en.wikipedia.org/wiki/Go_Away_Stowaway
How Cossacks Cooked Kulesh,1967-01-01T00:00:00Z,comedy film,"Volodymyr Dakhno (male, Soviet Union)",,589,tt1321406,Soviet Union,,,,,1967,
Quacker Tracker,1967-01-01T00:00:00Z,,"Rudy Larriva (male, United States)",,,tt0062166,United States,,,,,1967,https://en.wikipedia.org/wiki/Quacker_Tracker
Jack and the Witch,1967-03-19T00:00:00Z,"adventure anime and manga, adventure film, children's film, fantasy anime and manga, fantasy film","Taiji Yabushita (male, Japan)",,,tt0062260,Japan,,,,,1967,https://en.wikipedia.org/wiki/Jack_and_the_Witch
Q57393362,1967-01-01T00:00:00Z,,"Stoyan Dukov (male, Bulgaria)",,,,People's Republic of Bulgaria,,,,,1967,
Q28564962,1967-01-01T00:00:00Z,,"József Nepp (male, Hungary)",,,,Hungary,,,,,1967,
Q57343079,1967-01-01T00:00:00Z,,"Ivan Andonov (male, Kingdom of Bulgaria)",,,tt0170830,People's Republic of Bulgaria,,,,,1967,
Daffy's Diner,1967-01-01T00:00:00Z,,"Robert McKimson (male, United States)",,,tt0061548,United States,,,,,1967,https://en.wikipedia.org/wiki/Daffy%27s_Diner
The Box,1967-01-01T00:00:00Z,,"Fred Wolf (male, United States)",,8,tt0061421,United States,,,Academy Award for Best Animated Short Film,,1967,https://en.wikipedia.org/wiki/The_Box_(1967_film)
New York Mining Disaster 1941,1967-01-01T00:00:00Z,,,,,tt8598910,United Kingdom,,,,,1967,
Scrooge McDuck and Money,1967-01-01T00:00:00Z,,"Hamilton Luske (male, United States)",,16,tt0062240,United States,,,,,1967,https://en.wikipedia.org/wiki/Scrooge_McDuck_and_Money
Rock 'n' Rodent,1967-04-07T00:00:00Z,,"Abe Levitow (male, United States)",,6,tt0062209,United States,,,,,1967,https://en.wikipedia.org/wiki/Rock_%27n%27_Rodent
The Fuz,1967-12-01T00:00:00Z,"animated cartoon, comedy film, superhero film","Ralph Bakshi (male, United States)",,7,tt0148197,United States,,,,,1967,
Fiesta Fiasco,1967-01-01T00:00:00Z,,"Alex Lovy (male, United States)",,,tt0061663,United States,,,,,1967,https://en.wikipedia.org/wiki/Fiesta_Fiasco
Q57393361,1967-01-01T00:00:00Z,,"Donyo Donev (male, Bulgaria)",,,,People's Republic of Bulgaria,,,,,1967,
Purr-Chance to Dream,1967-01-01T00:00:00Z,,"Ben Washam (male, United States)",,5,tt0062162,United States,,,,,1967,https://en.wikipedia.org/wiki/Purr-Chance_to_Dream
Shutter Bugged Cat,1967-06-23T00:00:00Z,comedy film,"Joseph Barbera (male, United States)",,6,tt0062265,United States,,,,,1967,https://en.wikipedia.org/wiki/Shutter_Bugged_Cat
Banished from Eden,1967-01-01T00:00:00Z,live-action/animated film,"Todor Dinov (male, Bulgaria)",,7,tt0348646,People's Republic of Bulgaria,,,,,1967,
How to Be a Grown-Up,1967-01-01T00:00:00Z,,"Vladimir Degtyaryov (male, Russian Empire)",,10,tt6071076,Soviet Union,,,,,1967,
Cyborg 009: Monster Wars,1967-03-19T00:00:00Z,,,,,,Japan,,,,,1967,
Q21148914,1967-01-01T00:00:00Z,,"Boris Stepantsev (male, Soviet Union)",,,tt4303526,Soviet Union,,,,,1967,
Q23894308,1967-01-01T00:00:00Z,,"Béla Vajda (male, Hungary)",,,tt3455448,Hungary,,,,,1967,
Pink Posies,1967-01-01T00:00:00Z,,"Hawley Pratt (male, United States)",,6,tt0062125,United States,,,,,1967,https://en.wikipedia.org/wiki/Pink_Posies
The Mouse from H.U.N.G.E.R.,1967-01-01T00:00:00Z,,"Abe Levitow (male, United States)",,6,tt0061997,United States,,,,,1967,https://en.wikipedia.org/wiki/The_Mouse_from_H.U.N.G.E.R.
How I Won the War,1967-01-01T00:00:00Z,"comedy film, drama film, film based on a novel","Richard Lester (male, United States)","Michael Hordern (male, United Kingdom of Great Britain and Ireland), Roy Kinnear (male, United Kingdom)",106,tt0061789,United Kingdom,,,,,1967,https://en.wikipedia.org/wiki/How_I_Won_the_War
Agent 077: From the Orient with Fury,1968-09-27T00:00:00Z,"action film, adventure film, parody film, spy film","Sergio Grieco (male, Italy)","Dario De Grassi (male, Kingdom of Italy), Evi Marandi (female, Greece), Fabienne Dali (female, Belgium), Vittorio Sanipoli (male, Kingdom of Italy)",94,tt0058881,Spain,,,,,1968,https://en.wikipedia.org/wiki/Agent_077:_From_the_Orient_with_Fury
Z,1969-12-08T00:00:00Z,"drama film, political thriller film","Costa-Gavras (male, France)","Guy Mairesse (male, France), Jean Bouise (male, France), Jean-Pierre Miquel (male, France), José Artur (male, France), Sid Ahmed Agoumi (male, Algeria)",127,tt0065234,France,,17300000,Academy Award for Best International Feature Film,,1969,https://en.wikipedia.org/wiki/Z_(1969_film)
Le gendarme se marie,1970-03-13T00:00:00Z,comedy film,"Jean Girault (male, France)","Bernard Lavalette (male, France), Christian Marin (male, France), Claude Bertrand (male, France), Claude Gensac (female, France), Dominique Davray (female, France), Dominique Zardi (male, France), France Rumilly (female, France), Geneviève Grad (female, France), Guy Grosso (male, France), Henri Guégan (male, France), Jacky Blanchot (male, France), Jean Lefebvre (male, France), Jean Ozenne (male, France), Jerry Calà (male, Italy), Louis de Funès (male, France), Mario David (male, France), Maurizio Bonuglia (male, Italy), Michel Galabru (male, France), Michel Modo (male, France), Nicole Garcia (female, France), Nicole Vervil (female, France), René Berthier (male, France), Robert Destain (male, France), Rudy Lenoir (male, France), Yves Barsacq (male, France), Yves Vincent (male, France)",92,tt0063005,France,,,,,1970,https://en.wikipedia.org/wiki/Le_Gendarme_se_marie
Le Gendarme en balade,1970-10-28T00:00:00Z,"crime comedy film, flashback film","Jean Girault (male, France)","Jean Valmence (male, France), Ugo Fangareggi (male, Kingdom of Italy), Yvan Varco (male, France), Yves Barsacq (male, France), Yves Vincent (male, France)",100,tt0065769,France,,,,,1970,https://en.wikipedia.org/wiki/Le_Gendarme_en_balade
Patton,1970-02-04T00:00:00Z,"biographical film, drama film, war film","Franklin J. Schaffner (male, United States)","Gerald Flood (male, United Kingdom), Michael Strong (male, United States)",170,tt0066206,United States,12600000,61800000,"Academy Award for Best Actor, Academy Award for Best Director, Academy Award for Best Film Editing, Academy Award for Best Picture, Academy Award for Best Production Design, Academy Award for Best Sound, National Board of Review Award for Best Film",,1970,https://en.wikipedia.org/wiki/Patton_(film)
Max et les Ferrailleurs,1971-01-01T00:00:00Z,"crime film, drama film","Claude Sautet (male, France)","Albert Augier (male, France), Bernard Fresson (male, France), Bernard Musson (male, France), Betty Beckers (female, France), Boby Lapointe (male, France), Dany Jacquet (female, France), Dominique Zardi (male, France), François Périer (male, France), Georges Wilson (male, France), Henri Coutet (male, France), Henri-Jacques Huet (male, France), Jacques Cottin (male, France), Léa Gray (female, Belgium), Maurice Auzel (male, France), Michel Creton (male, France), Michel Dupleix (male, France), Michel Piccoli (male, France), Philippe Léotard (male, France), Robert Favart (male, France), Romy Schneider (female, Austria)",102,tt0067409,France,,,,,1971,https://en.wikipedia.org/wiki/Max_et_les_ferrailleurs
The Price of Death,1971-12-17T00:00:00Z,Spaghetti Western,"Vincenzo Gicca Palli (male, Kingdom of Italy)","Alfredo Rizzo (male, Kingdom of Italy), Laura Gianoli (female, Kingdom of Italy), Luigi Casellato (male, Italy), Osiride Pevarello (male, Kingdom of Italy)",92,tt0067395,Italy,,,,,1971,https://en.wikipedia.org/wiki/The_Price_of_Death
Walter Defends Sarajevo,1972-01-01T00:00:00Z,"partisan film, war film","Hajrudin Krvavac (male, Socialist Federal Republic of Yugoslavia)","Boro Begović (male, Serbia), Dragomir Bojanić (male, Federal Republic of Yugoslavia), Emir Kusturica (male, France), Faruk Begolli (male, Serbia and Montenegro), Fred Delmare (male, German Democratic Republic), Hannjo Hasse (male, Germany), Herbert Köfer (male, Germany), Jovan Janićijević Burduš (male, Serbia), Ljubiša Samardžić (male, Yugoslavia), Miralem Zupčević (male, Bosnia and Herzegovina), Neda Spasojević (female, Socialist Federal Republic of Yugoslavia), Pavle Vuisić (male, Socialist Federal Republic of Yugoslavia), Rade Marković (male, Serbia), Ramiz Sekić (male, Serbia), Ranko Gučevac (male, Serbia), Relja Bašić (male, Socialist Federal Republic of Yugoslavia), Rolf Römer (male, German Democratic Republic), Slobodan Dimitrijević (male, Croatia), Stevo Žigon (male, Serbia and Montenegro), Velimir Bata Živojinović (male, Yugoslavia), Vladan Holec (male, Serbia), Voja Mirić (male, Serbia), Wilhelm Koch-Hooge (male, German Democratic Republic)",133,tt0069452,Yugoslavia,,,,,1972,https://en.wikipedia.org/wiki/Walter_Defends_Sarajevo
Be-Imaan,1972-01-01T00:00:00Z,drama film,"Sohanlal Kanwar (male, India)","Manoj Kumar (male, India), Nazima (female, India), Pran (male, British Raj), Prem Chopra (male, India), Premnath (male, Dominion of India), Raj Mehra (male, India), Rakhee Gulzar (female, India), Sulochana Latkar (female, British Raj)",,tt0149814,India,,,Filmfare Award for Best Film,,1972,https://en.wikipedia.org/wiki/Be-Imaan
The Landlord,1972-01-02T00:00:00Z,"drama film, romantic comedy","Hal Ashby (male, United States)","Marki Bey (female, United States)",110,tt0065963,United States,1950000,,,,1972,https://en.wikipedia.org/wiki/The_Landlord
Les Mystères de Paris,1973-12-27T00:00:00Z,"adventure film, film based on literature, romance film","André Hunebelle (male, France)","Alain Bouvette (male, France), Bernard Musson (male, France), Dany Robin (female, France), Georges Chamarat (male, France), Jean Marais (male, France), Jill Haworth (female, United Kingdom), Noël Roquevert (male, France), Paulette Dubost (female, France), Pierre Mondy (male, France), Raoul Billerey (male, France), Raymond Pellegrin (male, France), Robert Dalban (male, France)",110,tt0056268,France,,,,,1973,https://en.wikipedia.org/wiki/The_Mysteries_of_Paris_(1962_film)
Three Nuts for Cinderella,1973-01-01T00:00:00Z,"Christmas film, cinematic fairy tale, comedy film, fantasy film, romance film","Václav Vorlíček (male, Czechoslovakia)","Jan Šůs (male, ), Ursula Möckel (female, )",75,tt0070832,Germany,,,,,1973,https://en.wikipedia.org/wiki/Three_Wishes_for_Cinderella_(1973_film)
Last Days of Mussolini,1974-01-01T00:00:00Z,"biographical film, drama film, war film","Carlo Lizzani (male, Italy)","Andrea Aureli (male, Italy), Bruno Corazzari (male, Italy), Franco Balducci (male, Italy), Giuseppe Addobbati (male, Kingdom of Italy), John Stacy (male, Australia), Luciano Pigozzi (male, Kingdom of Italy), Marco Guglielmi (male, Kingdom of Italy), Massimo Sarchielli (male, Kingdom of Italy), Rosita Toros (female, Italy), Tom Felleghy (male, Hungary), Umberto Raho (male, Italy)",110,tt0071880,Italy,,,,,1974,https://en.wikipedia.org/wiki/Last_Days_of_Mussolini
Innocents with Dirty Hands,1975-05-23T00:00:00Z,"crime film, drama film, film based on a novel","Claude Chabrol (male, France)","Dominique Zardi (male, France), François Maistre (male, France), François Perrot (male, France), Gilbert Servien (male, France), Henri Attal (male, France), Jean Cherlian (male, France), Paolo Giusti (male, Italy), Pierre Santini (male, Italy), René Havard (male, France), Rod Steiger (male, United States), Serge Bento (male, France)",125,tt0073169,Italy,,,,,1975,https://en.wikipedia.org/wiki/Innocents_with_Dirty_Hands
Illustrious Corpses,1976-05-26T00:00:00Z,"crime film, drama film, film based on literature, political thriller film","Francesco Rosi (male, Italy)","Ernesto Colli (male, Italy), Tino Carraro (male, Kingdom of Italy)",120,tt0074262,Italy,,,David di Donatello for Best Film,,1976,https://en.wikipedia.org/wiki/Illustrious_Corpses
Die Dämonen,1977-01-01T00:00:00Z,,"Claus Peter Witt (male, Germany)","Anita Lochner (female, Germany), Christoph Bantzer (male, Germany), Claus Enskat (male, ), Dieter Kursawe (male, Germany), Eva Zlonitzky (female, Germany), Georg Eilert (male, Germany), Gerlach Fiedler (male, Germany), Gottfried Kramer (male, Germany), Günter Strack (male, Germany), Hanna Schygulla (female, Germany), Hanna Seiffert (female, ), Hannes Messemer (male, Germany), Hans-Helmut Dickow (male, Germany), Helmut Qualtinger (male, Austria), Henning Gissel (male, Germany), Horst Hesslein (male, Germany), Katharina Brauren (female, Germany), Katharina Tüschen (female, Germany), Klaus Schwarzkopf (male, Germany), Lisa Kreuzer (female, Germany), Lutz Mackensy (male, Germany), Maria Wimmer (female, Germany), Michael Danisch (male, Germany), Michael Hanemann (male, Germany), Otto Kurth (male, Germany), Stephan Orlac (male, Germany), Sylvia Dudek (female, ), Ursela Monn (female, Switzerland), Volker Lechtenbrink (male, Germany), Willi Kowalj (male, Germany), Witta Pohl (female, Germany)",,tt0075499,Germany,,,,,1977,
No Apple for Johnny,1977-01-01T00:00:00Z,,"John Weldon (male, Canada)",,,tt0212391,Canada,,,,,1977,
My Name Is Anthony Gonsalves,1977-05-27T00:00:00Z,,"Manmohan Desai (male, British Raj)","Amitabh Bachchan (male, India), Parveen Babi (female, India)",,,India,,,,,1977,
Furies,1977-01-01T00:00:00Z,,,,3,,United States,,,,,1977,https://en.wikipedia.org/wiki/Furies_(1977_film)
Taxi Driver,1977-03-12T00:00:00Z,"action film, crime drama film, crime thriller film, drama fiction, drama film, film noir, neo-noir, police procedural film, psychological thriller film, thriller film, vigilante film","Martin Scorsese (male, United States)","Peter Savage (male, Kingdom of Italy)",114,tt0075314,United States,1900000,28570902,Palme d'Or,1970s,1977,https://en.wikipedia.org/wiki/Taxi_Driver
Parda Hai Parda,1977-05-27T00:00:00Z,"filmi music, ghazal","Manmohan Desai (male, India)","Neetu Singh (female, India), Rishi Kapoor (male, India)",,,India,,,,,1977,
Noroît,1977-09-16T00:00:00Z,drama film,"Jacques Rivette (male, France)","Humbert Balsan (male, France)",145,tt0074974,France,,,,,1977,https://en.wikipedia.org/wiki/Noro%C3%AEt_(film)
Human Feelings,1978-10-16T00:00:00Z,comedy television program,"Ernest Pintoff (male, United States)","Armand Assante (male, United States), Art Metrano (male, United States), Biff Yeager (male, United States), Billy Crystal (male, United States), Donna Pescow (female, United States), Jack Carter (male, United States), James Whitmore Jr. (male, United States), John Cherry Monks Jr. (male, United States), John Fiedler (male, United States), Nancy Walker (female, United States), Pamela Des Barres (female, United States), Pamela Sue Martin (female, United States), Pat Morita (male, Japan), Richard Dimitri (male, United States), Squire Fridell (male, United States), Tom Pedi (male, United States)",,tt0077704,United States,,,,,1978,
Science Ninja Team Gatchaman: The Movie,1978-01-01T00:00:00Z,"action film, science fiction anime and manga, science fiction film, superhero film","Hisayuki Toriumi (male, Japan)",,110,tt0415906,Japan,,,,,1978,https://en.wikipedia.org/wiki/Science_Ninja_Team_Gatchaman:_The_Movie
Wuthering Heights - Version 1,1978-01-01T00:00:00Z,"art pop, art rock","Keith McMillan (male, United Kingdom)","Kate Bush (female, United Kingdom)",223,tt6887574,United Kingdom,,,,,1978,
Contact,1978-01-01T00:00:00Z,"science fiction, science fiction film","Vladimir Tarasov (male, Soviet Union)",,612,tt0803764,Soviet Union,,,,,1978,https://en.wikipedia.org/wiki/Contact_(1978_film)
Anne no Nikki: Anne Frank Monogatari,1978-01-01T00:00:00Z,,,,,tt22177938,Japan,,,,,1978,https://en.wikipedia.org/wiki/Anne_no_Nikki:_Anne_Frank_Monogatari
Hairy Pot-Pourri,1978-01-01T00:00:00Z,"animated film, cinematic fairy tale, short film","Zdeněk Smetana (male, Czechoslovakia)",,11,tt0250818,Czechoslovakia,,,,,1978,
Les Travailleurs de la nuit,1978-01-01T00:00:00Z,chanson,,,,,,,,,,1978,
How the Cossacks Became Olympians,1978-01-01T00:00:00Z,,"Volodymyr Dakhno (male, Soviet Union)",,16,tt5524300,Soviet Union,,,,,1978,
Star Trek: Planet of the Titans,1978-01-01T00:00:00Z,"adventure film, science fiction film","Philip Kaufman (male, United States)",,,,United States,,,,23rd century,1978,https://en.wikipedia.org/wiki/Star_Trek:_Planet_of_the_Titans
¡Que viva México!,1978-01-01T00:00:00Z,drama film,"Grigori Aleksandrov (male, Russian Empire), Sergei Eisenstein (male, Russian Empire)","Raúl de Anda (male, Mexico), Sara García (female, Mexico)",103,tt0079020,Soviet Union,,,,,1978,https://en.wikipedia.org/wiki/%C2%A1Que_viva_M%C3%A9xico!_(unfinished_film)
Firefly,1978-01-01T00:00:00Z,children's film,"Anatoly Petrov (male, Soviet Union)",,256,tt1329246,Soviet Union,,,,,1978,
The Small One,1978-01-01T00:00:00Z,"Christmas film, family film","Don Bluth (male, United States)",,26,tt0078281,United States,,,,,1978,https://en.wikipedia.org/wiki/The_Small_One
The Cricket and the Violin,1978-01-01T00:00:00Z,"animated film, children's film, family film, short film","Zdeněk Miler (male, Czech Republic)",,5,tt0372840,Czechoslovakia,,,,,1978,
Les Jeunes Filles,1978-01-01T00:00:00Z,comedy drama,"Lazare Iglesis (male, France)","Emmanuelle Riva (female, France), Jean Piat (male, France), Yolande Folliot (female, France)",215,tt0207557,France,,,,,1978,
L’évasion,1978-01-01T00:00:00Z,drama fiction,"Jean-Pierre Jeunet (male, France), Marc Caro (male, France)",,,tt0078551,France,,,,,1978,
Wuthering Heights - Version 2,1978-01-01T00:00:00Z,"art pop, art rock","Keith McMillan (male, United Kingdom)","Kate Bush (female, United Kingdom)",,tt6887578,United Kingdom,,,,,1978,
Rip Van Winkle,1978-01-01T00:00:00Z,film adaptation,"Will Vinton (male, United States)",,29,tt0078168,United States,,,,,1978,
Who Killed Bambi?,1978-01-01T00:00:00Z,,,,,,,,,,,1978,https://en.wikipedia.org/wiki/Who_Killed_Bambi%3F_(unfinished_film)
Oriental Nightfish,1978-01-01T00:00:00Z,,,,,tt0261140,United Kingdom,,,,,1978,https://en.wikipedia.org/wiki/The_Oriental_Nightfish
Pet Pink Pebbles,1978-01-01T00:00:00Z,,"Art Leonardi (male, ), Gerry Chiniquy (male, United States)",,,tt0151947,,,,,,1978,https://en.wikipedia.org/wiki/Pet_Pink_Pebbles
The Parcel,1978-01-01T00:00:00Z,children's film,"Galina Barinova (female, Soviet Union)",,1,tt1329221,Soviet Union,,,,,1978,
The Man with the Child in His Eyes,1978-05-01T00:00:00Z,progressive pop,"Keith McMillan (male, United Kingdom)","Kate Bush (female, United Kingdom)",171,tt9207656,United Kingdom,,,,,1978,
The Mountain Master,1978-01-01T00:00:00Z,skaz,"Inessa Kovalevskaya (female, Russia)",,18,tt2789840,Soviet Union,,,,,1978,
A Connecticut Rabbit in King Arthur's Court,1978-02-23T00:00:00Z,,"Chuck Jones (male, Japan)",,25,tt0077365,United States,,,,,1978,https://en.wikipedia.org/wiki/Bugs_Bunny_in_King_Arthur%27s_Court
Butterfiy and Tiger,1978-01-01T00:00:00Z,children's film,"Valeriy Ugarov (male, Soviet Union)",,250,tt1329108,Soviet Union,,,,,1978,
Abventures of Homa,1978-01-01T00:00:00Z,"cinematic fairy tale, comedy film","Garri Bardin (male, Russia)",,547,tt1294200,Soviet Union,,,,,1978,
Hammer Horror,1978-10-01T00:00:00Z,"art rock, baroque pop, glam rock","Keith McMillan (male, United Kingdom)","Kate Bush (female, United Kingdom)",257,tt9207660,United Kingdom,,,,,1978,
Hokusai: An Animated Sketchbook,1978-01-01T00:00:00Z,documentary film,Tony White,,6,tt0215852,United Kingdom,,,,,1978,
Video Killed the Radio Star,1979-01-01T00:00:00Z,,"Russell Mulcahy (male, Australia)",,,tt4664600,United Kingdom,,,,,1979,
The Spirit of Mountains and the Bearded Dontovka,1979-01-01T00:00:00Z,"animated film, children's film, cinematic fairy tale, puppet film, short film","Zdeněk Vinš (male, Czechoslovakia)",,14,tt1468339,German Democratic Republic,,,,,1979,
Q57393385,1979-01-01T00:00:00Z,,"Stoyan Dukov (male, Bulgaria)",,,tt0289959,People's Republic of Bulgaria,,,,,1979,
The Spirit of Mountains and Glazier Matej,1979-01-01T00:00:00Z,"animated film, children's film, cinematic fairy tale, puppet film, short film","Barbara Theime (male, ), Barbara Thieme (female, )",,14,tt1427248,Germany,,,,,1979,
Go West,1979-01-01T00:00:00Z,,,,,tt8555190,United States,,,,,1979,
The Cricket and the Hen,1979-01-01T00:00:00Z,"animated film, children's film, family film, short film","Zdeněk Miler (male, Czech Republic)",,5,tt0372843,Czechoslovakia,,,,,1979,
About Maryska and the Wolves Castle,1979-01-01T00:00:00Z,"animated film, children's film, cinematic fairy tale, horror film, puppet film","Edgar Dutka (male, )",,15,tt4411790,Czechoslovakia,,,,,1979,
