title,summary,release_date,genre,director,duration,imdb_id,country,sitelinks,year
Son of the South,,2021-02-05T00:00:00Z,"drama film, biographical film, historical drama, political drama",Barry Alexander Brown,106,tt2235372,,12,2021
The Starling,,2021-01-01T00:00:00Z,drama film,Theodore Melfi,103,tt5164438,,12,2021
Military Wives,,2021-12-23T00:00:00Z,"drama film, comedy film",Peter Cattaneo,112,tt8951692,,12,2021
Bliss,,2021-02-05T00:00:00Z,"drama film, science fiction film",Mike Cahill,103,tt10333426,,12,2021
Every Breath You Take,,2021-04-02T00:00:00Z,"drama film, psychological thriller",Vaughn Stein,102,tt2231874,,12,2021
Lansky,,2021-06-25T00:00:00Z,"biographical film, crime film",Eytan Rockaway,,tt5078852,,12,2021
Between Two Worlds,,2021-07-07T00:00:00Z,drama film,Emmanuel Carrère,106,tt10088984,,12,2021
How to Be a Good Wife,,2021-08-05T00:00:00Z,comedy film,Martin Provost,110,tt10441958,,12,2021
Flora & Ulysses,,2021-02-19T00:00:00Z,"comedy film, children's film",Lena Khan,95,tt8521736,,12,2021
Margrete: Queen of the North,,2021-08-21T00:00:00Z,"drama film, biographical film, historical drama, historical film",Charlotte Sieling,110,tt9308390,,12,2021
Benediction,,2021-09-12T00:00:00Z,"drama film, biographical film, historical film",Terence Davies,137,tt6852178,,12,2021
The Last Mercenary,,2021-07-30T00:00:00Z,action comedy film,David Charhon,110,tt12808182,,12,2021
Raging Fire,,2021-07-28T00:00:00Z,"crime film, police film, action thriller",Benny Chan,126,tt8165192,,12,2021
The Speech,,2021-06-09T00:00:00Z,"comedy film, romance film",Laurent Tirard,87,tt12105554,,12,2021
Finding 'Ohana,,2021-01-01T00:00:00Z,adventure film,Jude Weng,123,tt10332588,,12,2021
Vanquish,,2021-04-16T00:00:00Z,"action film, thriller film",George Gallo,96,tt5932368,,12,2021
In the Earth,,2021-01-01T00:00:00Z,"science fiction film, psychological horror film",Ben Wheatley,107,tt13429362,,12,2021
The Lady of Heaven,,2021-01-01T00:00:00Z,"medieval film, historical drama",Eli King,141,tt13097336,,12,2021
Dangerous,,2021-11-18T00:00:00Z,"action film, thriller film",David Hackl,99,tt3876910,,12,2021
The Pilot. A Battle for Survival,,2021-12-01T00:00:00Z,"drama film, war film, biographical film, historical film",Renat Davletyarov,105,tt14303882,,12,2021
Sentinelle,,2021-03-05T00:00:00Z,"drama film, action film, LGBT-related film",Julien Leclercq,80,tt11734264,,12,2021
Tides,,2021-01-01T00:00:00Z,"science fiction film, thriller film",Tim Fehlbaum,104,tt6506264,,12,2021
The Sadness,,2021-01-22T00:00:00Z,horror film,Rob Jabbaz,100,tt13872248,,12,2021
A Classic Horror Story,,2021-07-14T00:00:00Z,horror film,"Roberto De Feo, Paolo Strippoli",95,tt12877640,,12,2021
7 Prisoners,,2021-11-11T00:00:00Z,"drama film, crime film",Alex Moratto,94,tt14168118,,12,2021
Afterlife of the Party,,2021-09-02T00:00:00Z,"drama film, fantasy film, comedy film, romance film",Stephen Herek,109,tt11742798,,12,2021
This Rain Will Never Stop,,2021-03-27T00:00:00Z,documentary film,Alina Gorlova,104,tt13501592,,12,2021
Good on Paper,,2021-06-23T00:00:00Z,romantic comedy,Kimmy Gatewood,,tt8231668,,12,2021
Lingui,,2021-07-08T00:00:00Z,drama film,Mahamat Saleh Haroun,87,tt13846546,,12,2021
Trollhunters: Rise of the Titans,,2021-07-21T00:00:00Z,"drama film, fantasy film, comedy film, action film, adventure film, family film","Andrew L. Schmidt, Francisco Ruiz-Velasco, Johane Matte",106,tt12851396,,12,2021
Leave No Traces,,2021-01-01T00:00:00Z,drama film,Jan P. Matuszyński,160,tt13473548,,12,2021
"The Good, the Bart, and the Loki",,2021-07-07T00:00:00Z,comedy film,David Silverman,4,tt14957270,,12,2021
America: The Motion Picture,,2021-06-30T00:00:00Z,"fantasy film, comedy film, action film, adventure film, war film, science fiction film, historical film",Matt Thompson,98,tt6733874,,12,2021
My Hero Academia: World Heroes' Mission,,2021-08-06T00:00:00Z,"superhero film, action anime and manga",Kenji Nagasaki,104,tt13544716,,11,2021
Sing a Bit of Harmony,,2021-10-29T00:00:00Z,"drama film, science fiction film, musical film, romance film",Yasuhiro Yoshiura,,tt13064272,,11,2021
The Windshield Wiper,,2021-01-01T00:00:00Z,"fantasy film, romance film",Alberto Mielgo,14,tt9464038,,11,2021
Fabricated City,,2021-03-26T00:00:00Z,"action film, thriller film",Park Kwang-hyun,126,tt6399158,,11,2021
The Negotiation,,2021-12-03T00:00:00Z,"drama film, action film",Jong-suk Lee,114,tt6904272,,11,2021
Fisherman's Friends,,2021-07-07T00:00:00Z,"drama film, biographical film, comedy drama",Chris Foggin,112,tt1648186,,11,2021
Sooryavanshi,,2021-11-04T00:00:00Z,action film,Rohit Shetty,145,tt9531772,,11,2021
The Climbers,,2021-02-18T00:00:00Z,"drama film, adventure film",Daniel Lee,125,tt9635616,,11,2021
Dream Horse,,2021-08-12T00:00:00Z,"drama film, comedy film",Euros Lyn,113,tt9883996,,11,2021
Wendy,,2021-02-04T00:00:00Z,"drama film, fantasy film",Benh Zeitlin,111,tt2420124,,11,2021
Mona Lisa and the Blood Moon,,2021-09-05T00:00:00Z,"fantasy film, thriller film",Ana Lily Amirpour,106,tt8760670,,11,2021
SAS: Red Notice,,2021-01-01T00:00:00Z,,Magnus Martens,,tt4479380,,11,2021
Do You Do You Saint-Tropez,,2021-07-14T00:00:00Z,crime comedy film,Nicolas Benamou,90,tt10537660,,11,2021
American Traitor: The Trial of Axis Sally,,2021-05-28T00:00:00Z,"drama film, trial film",Michael Polish,109,tt7050946,,11,2021
Everybody's Talking About Jamie,,2021-01-22T00:00:00Z,"drama film, musical film, comedy drama, LGBT-related film",Jonathan Butterell,,tt8635092,,11,2021
Nine Days,,2021-07-30T00:00:00Z,fantasy film,Edson Oda,124,tt10451852,,11,2021
83,,2021-12-23T00:00:00Z,"drama film, biographical film, sport film",Kabir Khan,150,tt7518786,,11,2021
A Mermaid in Paris,,2021-08-06T00:00:00Z,fantasy film,Mathias Malzieu,,tt9209312,,11,2021
Bad Tales,,2021-05-21T00:00:00Z,drama film,"Damiano D'Innocenzo, Fabio D'Innocenzo",98,tt8526370,,11,2021
Atrangi Re,,2021-12-24T00:00:00Z,drama film,Aanand L. Rai,,tt9766332,,11,2021
The Forgiven,,2021-09-11T00:00:00Z,drama film,John Michael McDonagh,,tt3696180,,11,2021
"Farewell, Mr. Haffmann",,2021-11-12T00:00:00Z,"comedy drama, film based on literature",Fred Cavayé,116,tt10545704,,11,2021
Everything Went Fine,,2021-07-07T00:00:00Z,"drama film, comedy film, comedy drama",François Ozon,113,tt12847812,,11,2021
Zone 414,,2021-09-03T00:00:00Z,"science fiction film, thriller film",Andrew Baird,98,tt8545482,,11,2021
Mothering Sunday,,2021-07-09T00:00:00Z,drama film,Eva Husson,104,tt12229370,,11,2021
Apples,,2021-06-03T00:00:00Z,"drama film, comedy film",Christos Nikou,90,tt10110614,,11,2021
The Hating Game,,2021-01-01T00:00:00Z,"comedy film, romance film",Peter Hutchings,102,tt8718158,,11,2021
Apex,,2021-01-01T00:00:00Z,,Edward John Drake,93,tt13265876,,11,2021
Out of Death,,2021-07-15T00:00:00Z,,Mike Burns,95,tt12528166,,11,2021
Mass,,2021-10-08T00:00:00Z,drama film,Fran Kranz,110,tt11389748,,11,2021
Rurouni Kenshin: The Beginning,,2021-06-04T00:00:00Z,action film,Keishi Ōtomo,137,tt11991748,,11,2021
Even Mice Belong in Heaven,,2021-06-11T00:00:00Z,"fantasy film, comedy film, animated film, adventure film, family film, stop-motion animated film","Denisa Abrhámová, Jan Bubeníček",87,tt3804810,,11,2021
Stuck Together,,2021-01-01T00:00:00Z,comedy film,Dany Boon,125,tt13834006,,11,2021
Edge of the World,,2021-01-01T00:00:00Z,drama film,Michael Haussman,104,tt3006472,,11,2021
Delicious,,2021-01-13T00:00:00Z,"drama film, comedy film, historical film",Éric Besnard,112,tt10738536,,11,2021
Zeros and Ones,,2021-08-12T00:00:00Z,"war film, thriller film",Abel Ferrara,85,tt13432484,,11,2021
Three Wishes For Cinderella,,2021-11-12T00:00:00Z,"fantasy film, adventure film, romance film, cinematic fairy tale",Cecilie Mosli,90,tt10147580,,11,2021
The Princess Switch 3: Romancing the Star,,2021-11-18T00:00:00Z,"drama film, comedy film, romance film, family film",Michael Rohl,106,tt14731142,,11,2021
Bender: Gold of the Empire,,2021-07-15T00:00:00Z,"adventure film, action comedy film",Igor Zaytsev,87,tt15062980,,11,2021
Unclenching the Fists,,2021-07-10T00:00:00Z,drama film,Kira Kovalenko,97,tt14775666,,11,2021
Blue Miracle,,2021-01-01T00:00:00Z,drama film,Julio Quintana,,tt7084386,,11,2021
The Innocents,,2021-09-03T00:00:00Z,"drama film, horror film, thriller film",Eskil Vogt,117,tt4028464,,11,2021
Survive the Game,,2021-01-01T00:00:00Z,,James Cullen Bressack,,tt12861508,,11,2021
The Grandmother,,2021-10-22T00:00:00Z,horror film,Paco Plaza,100,tt11807888,,11,2021
Maixabel,,2021-09-24T00:00:00Z,drama film,Icíar Bollaín,115,tt14077696,,11,2021
Last Film Show,,2021-06-10T00:00:00Z,"drama film, coming-of-age film",Pan Nalin,110,tt9681686,,11,2021
No One Gets Out Alive,,2021-01-01T00:00:00Z,"horror film, thriller film",Santiago Menghini,85,tt13056008,,11,2021
Crayon Shin-chan: Shrouded in Mystery! The Flowers of Tenkasu Academy,,2021-07-30T00:00:00Z,"gag anime, adventure anime, action anime, mystery anime",Wataru Takahashi,104,tt13642590,,10,2021
Memoir of a Murderer,,2021-06-04T00:00:00Z,"action film, crime film, crime thriller film, film based on literature",Won Sin-yeon,118,tt5729348,,10,2021
This Is the Night,,2021-09-17T00:00:00Z,drama film,James DeMonaco,,tt7743120,,10,2021
The Souvenir Part II,,2021-01-01T00:00:00Z,drama film,Joanna Hogg,107,tt6992978,,10,2021
Kaamelott: The First Chapter,,2021-07-21T00:00:00Z,medieval fantasy,Alexandre Astier,,tt9844322,,10,2021
The Endless Trench,,2021-05-19T00:00:00Z,"drama film, thriller film, historical film","Jose Mari Goenaga, Jon Garaño, Aitor Arregi",147,tt7937168,,10,2021
On a Magical Night,,2021-10-14T00:00:00Z,comedy film,Christophe Honoré,86,tt10115562,,10,2021
Bad Trip,,2021-03-26T00:00:00Z,comedy film,Kitao Sakurai,86,tt9684220,,10,2021
Land,,2021-01-01T00:00:00Z,"drama film, psychological film",Robin Wright,89,tt10265034,,10,2021
The Good House,,2021-01-01T00:00:00Z,comedy drama,"Wallace Wolodarsky, Maya Forbes",114,tt3104956,,10,2021
The Third Wife,,2021-06-10T00:00:00Z,drama film,Ash Mayfair,92,tt7692966,,10,2021
France,,2021-07-15T00:00:00Z,"drama film, comedy drama",Bruno Dumont,133,tt9714030,,10,2021
Night Shift,,2021-09-30T00:00:00Z,drama film,Anne Fontaine,98,tt9850344,,10,2021
Thalaivi,,2021-09-10T00:00:00Z,biographical film,A. L. Vijay,,tt10152736,,10,2021
Delete History,,2021-05-14T00:00:00Z,"drama film, comedy film","Benoît Delépine, Gustave de Kervern",109,tt10627352,,10,2021
Mimi,,2021-01-01T00:00:00Z,,Laxman Utekar,,tt10895576,,10,2021
Detective Chinatown 3,,2021-02-12T00:00:00Z,"comedy film, action film, adventure film",Chen Sicheng,136,tt10370822,,10,2021
Sun Children,,2021-12-29T00:00:00Z,drama film,Majid Majidi,99,tt11767722,,10,2021
Ballad of a White Cow,,2021-06-17T00:00:00Z,drama film,"Maryam Moqadam, Behtash Sanaeeha",105,tt11773484,,10,2021
Run Hide Fight,,2021-01-14T00:00:00Z,"drama film, action film, thriller film",Kyle Rankin,109,tt11456054,,10,2021
Madeleine Collins,,2021-01-01T00:00:00Z,drama film,Antoine Barraud,107,tt11310670,,10,2021
The Big Hit,,2021-09-01T00:00:00Z,comedy drama,Emmanuel Courcol,105,tt12444440,,10,2021
The Mad Woman's Ball,,2021-01-01T00:00:00Z,drama film,Mélanie Laurent,,tt11681282,,10,2021
The Divide,,2021-01-01T00:00:00Z,drama film,Catherine Corsini,108,tt13321730,,10,2021
Loco por ella,,2021-01-01T00:00:00Z,"comedy film, romance film",Dani de la Orden,,tt11698630,,10,2021
The Last Warrior 3,,2021-12-23T00:00:00Z,"fantasy film, comedy film, adventure film, children's film",Dmitry Dyachenko,,tt13769630,,10,2021
The Relatives,,2021-02-11T00:00:00Z,"road movie, comedy drama",Ilya Aksyonov,98,tt13996386,,10,2021
The Auschwitz Report,,2021-01-28T00:00:00Z,"drama film, war film, historical film",Peter Bebjak,94,tt9415108,,10,2021
Encounter,,2021-12-03T00:00:00Z,,Michael Pearce,108,tt12800524,,10,2021
The Girl Who Believes in Miracles,,2021-04-02T00:00:00Z,drama film,Rich Correll,100,tt9098454,,10,2021
Nightbooks,,2021-09-15T00:00:00Z,"dark fantasy, film based on book",David Yarovesky,120,tt10521144,,10,2021
Deadly Illusions,,2021-01-01T00:00:00Z,"drama film, thriller film, LGBT-related film, erotic thriller film, lesbian-related film",Anna Elizabeth James,114,tt7897330,,10,2021
The Deep House,,2021-06-30T00:00:00Z,"drama film, horror film, thriller film, supernatural horror film","Julien Maury, Alexandre Bustillo",85,tt11686490,,10,2021
A Week Away,,2021-03-26T00:00:00Z,musical film,Roman White,97,tt11388278,,10,2021
American Underdog,,2021-01-01T00:00:00Z,"biographical film, American football film","Andrew Erwin, Jon Erwin",112,tt11729298,,10,2021
Mission Possible,,2021-02-17T00:00:00Z,"comedy film, action film",,105,tt14140954,,10,2021
Cube,,2021-10-22T00:00:00Z,thriller film,Yasuhiko Shimizu,108,tt13975458,,10,2021
A Journal for Jordan,,2021-12-10T00:00:00Z,drama film,Denzel Washington,131,tt0995854,,10,2021
Ninjababy,,2021-01-18T00:00:00Z,comedy drama,Yngvild Sve Flikke,103,tt13821562,,10,2021
Azor,,2021-01-01T00:00:00Z,drama film,Andreas Fontana,100,tt11136276,,10,2021
Hinterland,,2021-08-06T00:00:00Z,thriller film,Stefan Ruzowitzky,,tt13450470,,10,2021
Playground,,2021-07-08T00:00:00Z,drama film,Laura Wandel,72,tt11087960,,10,2021
Outlaws,,2021-10-08T00:00:00Z,thriller film,Daniel Monzón,129,tt11892272,,10,2021
V/H/S/94,,2021-01-01T00:00:00Z,"horror film, anthology film","Jennifer Reeder, Ryan Prows",103,tt14867006,,10,2021
Bender: The Beginning,,2021-06-24T00:00:00Z,"adventure film, action comedy film",Igor Zaytsev,96,tt15060248,,10,2021
Operation Hyacinth,,2021-01-01T00:00:00Z,"drama film, crime film",Q48847545,112,tt14315584,,10,2021
One Lagos Night,,2021-01-01T00:00:00Z,"comedy film, crime film",Ekene Som Mekwunye,,tt14211236,,10,2021
Friendzone,,2021-09-29T00:00:00Z,"comedy film, romance film",Charles Van Tieghem,88,tt14700948,,10,2021
Olga,,2021-01-01T00:00:00Z,drama film,Elie Grappe,85,tt13145186,,10,2021
The Trip,,2021-07-30T00:00:00Z,"comedy film, thriller film",Tommy Wirkola,113,tt13109952,,10,2021
A Loud House Christmas,,2021-11-26T00:00:00Z,"comedy film, adventure film, teen film, family film, Christmas film",Jonathan Judge,63,tt11947282,,10,2021
Summer Ghost,,2021-11-12T00:00:00Z,,loundraw,40,tt15052770,,10,2021
Plusaversary,,2021-11-12T00:00:00Z,comedy film,David Silverman,5,tt15829632,,10,2021
South Park: Post Covid,,2021-11-25T00:00:00Z,animated sitcom,Trey Parker,59,tt15005868,,10,2021
Robin Robin,,2021-11-24T00:00:00Z,"comedy film, adventure film, musical film, family film, Christmas film","Michael Please, Daniel Ojari",32,tt11332850,,9,2021
Castle Falls,,2021-01-01T00:00:00Z,action film,Dolph Lundgren,89,tt11377298,,9,2021
"Maria, Mirabela",,2021-05-21T00:00:00Z,"fantasy film, comedy film, musical film, children's film, live-action/animated film","Ion Popescu-Gopo, Natalia Bodiul",69,tt0155858,,9,2021
Rhino,,2021-01-01T00:00:00Z,"drama film, crime film",Oleh Sentsov,101,tt3781118,,9,2021
A Hard Day,,2021-05-14T00:00:00Z,"action film, crime film, thriller film, crime thriller film",Kim Seong-hun,111,tt3697626,,9,2021
Zátopek,,2021-01-01T00:00:00Z,"drama film, biographical film, sport film",David Ondříček,131,tt4806220,,9,2021
Monster,,2021-05-07T00:00:00Z,drama film,Anthony Mandler,,tt2850272,,9,2021
Spread Your Wings,,2021-01-01T00:00:00Z,adventure film,Nicolas Vanier,113,tt10204940,,9,2021
100 minutes from the life of Ivan Denisovich,,2021-08-13T00:00:00Z,drama film,Gleb Panfilov,104,tt15225256,,9,2021
My Dog Stupid,,2021-10-15T00:00:00Z,comedy film,Yvan Attal,105,tt10143498,,9,2021
Brothers by Blood,,2021-04-20T00:00:00Z,crime film,Jérémie Guez,,tt8368294,,9,2021
French Exit,,2021-02-12T00:00:00Z,"comedy film, film based on a novel",Azazel Jacobs,110,tt10279362,,9,2021
Avatar,,2022-09-22T00:00:00Z,"action film, adventure film, science fiction film, epic film, military science fiction, live-action/animated film, white savior film",James Cameron,162,tt0499549,,120,2022
The Dark Knight,,2022-09-08T00:00:00Z,"drama film, action film, crime film, superhero film, neo-noir, thriller film, crime thriller film",Christopher Nolan,153,tt0468569,,106,2022
Harry Potter and the Goblet of Fire,,2022-11-03T00:00:00Z,"fantasy film, adventure film, children's film, film based on a novel",Mike Newell,151,tt0330373,,89,2022
Harry Potter and the Prisoner of Azkaban,,2022-08-18T00:00:00Z,"fantasy film, adventure film, children's film, werewolf film, film based on a novel, time-travel film",Alfonso Cuarón,141,tt0304141,,89,2022
The Dark Knight Rises,,2022-10-06T00:00:00Z,"drama film, action film, superhero film, thriller film, crime thriller film",Christopher Nolan,164,tt1345836,,68,2022
Avatar: The Way of Water,,2022-12-14T00:00:00Z,"drama film, action film, adventure film, science fiction film, epic film, speculative fiction film",James Cameron,192,tt1630029,,67,2022
Turning Red,,2022-03-10T00:00:00Z,"fantasy film, comedy film, animated film, adventure film, family film",Domee Shi,100,tt8097030,,62,2022
The Batman,,2022-02-23T00:00:00Z,"drama film, action film, crime film, superhero film, thriller film, detective film",Matt Reeves,176,tt1877830,,60,2022
Doctor Strange in the Multiverse of Madness,,2022-05-04T00:00:00Z,"fantasy film, action film, horror film, adventure film, science fiction film, superhero film",Sam Raimi,126,tt9419884,,60,2022
Everything Everywhere All at Once,,2022-03-11T00:00:00Z,"action film, science fiction film, comedy drama, martial arts film, absurdist fiction, psychedelic film","Dan Kwan, Daniel Scheinert",139,tt6710474,,60,2022
Minions: The Rise of Gru,,2022-06-30T00:00:00Z,"comedy film, action film, family film",Kyle Balda,87,tt5113044,,57,2022
Black Panther: Wakanda Forever,,2022-11-09T00:00:00Z,action film,Ryan Coogler,161,tt9114286,,55,2022
Sonic the Hedgehog 2,,2022-05-03T00:00:00Z,"comedy film, action film, adventure film, science fiction film, live-action/animated film",Jeff Fowler,123,tt12412888,,55,2022
Thor: Love and Thunder,,2022-07-08T00:00:00Z,"action film, adventure film, science fiction film, superhero film",Taika Waititi,119,tt10648342,,54,2022
The Bad Guys,,2022-03-17T00:00:00Z,"comedy film, adventure film, crime film, family film",Pierre Perifel,100,tt8115900,,53,2022
Jurassic World Dominion,,2022-06-08T00:00:00Z,"fantasy film, action film, adventure film, science fiction film, biopunk, thriller film",Colin Trevorrow,146,tt8041270,,51,2022
Lightyear,,2022-06-16T00:00:00Z,"comedy film, adventure film, science fiction film, family film, superhero fiction, animated film with LGBT character(s)",Angus MacLane,100,tt10298810,,51,2022
Top Gun: Maverick,,2022-05-18T00:00:00Z,"drama film, action film",Q2444076,130,tt1745960,,49,2022
Sing 2,,2022-01-20T00:00:00Z,"comedy film, animated film, musical film, family film",Garth Jennings,110,tt6467266,,47,2022
Bullet Train,,2022-07-18T00:00:00Z,"action film, thriller film, action comedy film, film based on a novel",David Leitch,126,tt12593682,,47,2022
Uncharted,,2022-02-10T00:00:00Z,"action film, adventure film",Ruben Fleischer,116,tt1464335,,46,2022
Fantastic Beasts: The Secrets of Dumbledore,,2022-04-07T00:00:00Z,"drama film, fantasy film, adventure film, family film",David Yates,142,tt4123432,,45,2022
Hotel Transylvania: Transformania,,2022-01-14T00:00:00Z,"fantasy film, comedy film, horror film, adventure film, monster film, family film, vampire film, werewolf film","Derek Drymon, Jennifer Kluska",87,tt9848626,,45,2022
Elvis,,2022-05-25T00:00:00Z,"drama film, biographical film, musical film, gambling film",Baz Luhrmann,159,tt3704428,,45,2022
Puss in Boots: The Last Wish,,2022-12-07T00:00:00Z,"fantasy, fantasy film, comedy film, thriller, action film, animated film, adventure film, musical film, family film, cinematic fairy tale, thriller film",Joel Crawford,100,tt3915174,,45,2022
Black Adam,,2022-10-19T00:00:00Z,"fantasy film, action film, adventure film, science fiction film, superhero film, speculative fiction film",Jaume Collet-Serra,124,tt6443346,,44,2022
Morbius,,2022-03-30T00:00:00Z,"drama film, action film, horror film, adventure film, science fiction film, superhero film, vampire film, thriller film, speculative fiction film",Daniel Espinosa,104,tt5108870,,44,2022
RRR,,2022-03-24T00:00:00Z,action film,S. S. Rajamouli,181,tt8178634,,44,2022
The King's Man,,2022-01-06T00:00:00Z,"comedy film, action film, adventure film, spy film",Matthew Vaughn,131,tt6856242,,42,2022
Triangle of Sadness,,2022-05-21T00:00:00Z,"drama film, comedy film",Ruben Östlund,149,tt7322224,,42,2022
All Quiet on the Western Front,,2022-09-12T00:00:00Z,"drama film, war film, film based on a novel",Edward Berger,147,tt1016150,,42,2022
Strange World,,2022-11-24T00:00:00Z,"science fiction, fantasy film, adventure film, animated film with LGBT character(s)",Don Hall,102,tt10298840,,42,2022
The Whale,,2022-09-04T00:00:00Z,"drama film, psychological drama film",Darren Aronofsky,117,tt13833688,,41,2022
The Black Phone,,2022-06-22T00:00:00Z,"horror film, thriller film, ghost film, supernatural horror film",Scott Derrickson,102,tt7144666,,40,2022
The Banshees of Inisherin,,2022-09-05T00:00:00Z,"black comedy, drama film, comedy film, tragicomedy",Martin McDonagh,114,tt11813216,,40,2022
Death on the Nile,,2022-02-09T00:00:00Z,"drama film, crime film, mystery film, detective film, film based on a novel",Kenneth Branagh,127,tt7657566,,39,2022
The Fabelmans,,2022-09-10T00:00:00Z,"drama film, coming-of-age film",Steven Spielberg,151,tt14208870,,39,2022
Guillermo del Toro's Pinocchio,,2022-12-09T00:00:00Z,"fantasy film, musical film, cinematic fairy tale, film based on a novel","Guillermo del Toro, Mark Gustafson",114,tt1488589,,39,2022
Suzume,,2022-11-11T00:00:00Z,"road movie, coming-of-age film, adventure anime, fantasy anime, drama anime",Makoto Shinkai,121,tt16428256,,38,2022
Scream,,2022-01-12T00:00:00Z,"metafiction, slasher film, comedy horror film","Matt Bettinelli-Olpin, Tyler Gillett",114,tt11245972,,38,2022
Babylon,,2022-12-23T00:00:00Z,"drama film, period drama film, historical drama",Damien Chazelle,189,tt10640346,,38,2022
Glass Onion: A Knives Out Mystery,,2022-09-13T00:00:00Z,"drama film, comedy film, crime film, mystery film, police film, thriller film",Rian Johnson,140,tt11564570,,36,2022
Nightmare Alley,,2022-01-19T00:00:00Z,"drama film, thriller film, film based on a novel",Guillermo del Toro,150,tt7740496,,36,2022
Moonfall,,2022-02-03T00:00:00Z,"science fiction film, disaster film, apocalyptic film",Roland Emmerich,120,tt5834426,,36,2022
Belfast,,2022-02-24T00:00:00Z,"drama film, comedy film, biographical film",Kenneth Branagh,97,tt12789558,,36,2022
M3GAN,,2022-12-07T00:00:00Z,"horror film, science fiction film, thriller film, comedy horror film",Gerard Johnstone,102,tt8760708,,36,2022
Blonde,,2022-09-08T00:00:00Z,"drama film, biographical film, historical film, film based on a novel",Andrew Dominik,167,tt1655389,,35,2022
The Guardians of the Galaxy Holiday Special,,2022-11-25T00:00:00Z,"comedy film, action film, adventure film, science fiction film, superhero film, Christmas film, speculative fiction comedy",James Gunn,42,tt13623136,,35,2022
DC League of Super-Pets,,2022-01-01T00:00:00Z,"comedy film, superhero film, action comedy film",Jared Stern,105,tt8912936,,35,2022
Nope,,2022-07-22T00:00:00Z,"horror film, science fiction film, mystery film, thriller film",Jordan Peele,130,tt10954984,,35,2022
Smile,,2022-09-29T00:00:00Z,psychological horror film,Parker Finn,115,tt15474916,,35,2022
King Richard,,2022-02-24T00:00:00Z,"drama film, biographical film, sport film",Reinaldo Marcus Green,144,tt9620288,,34,2022
Dungeons & Dragons: Honor Among Thieves,,2022-05-27T00:00:00Z,"fantasy film, comedy film, adventure film, speculative fiction film, sword and sorcery film","John Francis Daley, Jonathan Goldstein",108,tt2906216,,34,2022
The Menu,,2022-09-10T00:00:00Z,"black comedy, comedy horror, thriller film",Mark Mylod,106,tt9764362,,34,2022
Tár,,2022-09-01T00:00:00Z,"drama film, musical film, LGBT-related film, psychological film",Todd Field,158,tt14444726,,34,2022
Fall,,2022-08-12T00:00:00Z,"thriller film, survival film",Scott Mann,106,tt15325794,,34,2022
The 355,,2022-01-05T00:00:00Z,"action film, girls with guns, spy film, action thriller",Simon Kinberg,122,tt8356942,,33,2022
Don't Worry Darling,,2022-09-05T00:00:00Z,"drama film, horror film, psychological thriller, mystery film, thriller film",Olivia Wilde,120,tt10731256,,33,2022
A Man Called Otto,,2022-12-29T00:00:00Z,"drama film, comedy film, film based on a novel",Marc Forster,126,tt7405458,,33,2022
The Northman,,2022-04-15T00:00:00Z,"epic film, thriller film, medieval film, historical film",Robert Eggers,137,tt11138512,,32,2022
Resident Evil: Welcome to Raccoon City,,2022-01-06T00:00:00Z,"horror film, biopunk, zombie film, science fiction horror film",Johannes Roberts,106,tt6920084,,32,2022
Amsterdam,,2022-01-01T00:00:00Z,"drama film, crime film, historical film",David O. Russell,134,tt10304142,,32,2022
The Gray Man,,2022-07-13T00:00:00Z,"action film, thriller film, action thriller, film based on a novel","Anthony Russo, Joe Russo",129,tt1649418,,32,2022
Drive My Car,,2022-03-17T00:00:00Z,drama film,Ryusuke Hamaguchi,179,tt14039582,,32,2022
Licorice Pizza,,2022-01-05T00:00:00Z,"comedy drama, historical drama, coming-of-age film",Paul Thomas Anderson,133,tt11271038,,31,2022
Spencer,,2022-01-13T00:00:00Z,"drama film, biographical film",Pablo Larraín,117,tt12536294,,31,2022
Barbarian,,2022-09-09T00:00:00Z,"horror film, thriller film",Zach Cregger,102,tt15791034,,30,2022
Halloween Ends,,2022-10-12T00:00:00Z,"horror film, slasher film",David Gordon Green,111,tt10665342,,30,2022
Operation Fortune: Ruse de guerre,,2022-06-16T00:00:00Z,"action film, spy film, thriller film, action comedy film",Guy Ritchie,114,tt7985704,,30,2022
