title,summary,release_date,genre,director,duration,imdb_id,country,sitelinks,wikipedia_link,year
Gladiator,,2023-05-19T00:00:00Z,"drama film, action film, adventure film, epic film, sword-and-sandal film, melodrama, historical film",Ridley Scott,155,tt0172495,,108,https://en.wikipedia.org/wiki/Gladiator,2023
Oppenheimer,,2023-07-20T00:00:00Z,"drama film, biographical film, epic film, thriller film, historical film, film based on book",Christopher Nolan,180,tt15398776,,77,https://en.wikipedia.org/wiki/Oppenheimer,2023
Barbie,,2023-01-01T00:00:00Z,"fantasy film, comedy film, adventure film, musical film, romantic comedy, romance film, teen film, family film, musical comedy, chick flick, satirical film or television program, fantasy comedy film",Greta Gerwig,114,tt1517268,,69,https://en.wikipedia.org/wiki/Barbie,2023
Spider-Man: Across the Spider-Verse,,2023-06-01T00:00:00Z,"comedy film, action film, superhero film, action comedy film, drama fiction","Joaquim Dos Santos, Kemp Powers, Justin K. Thompson",140,tt9362722,,57,https://en.wikipedia.org/wiki/Spider-Man%3A_Across_the_Spider-Verse,2023
Guardians of the Galaxy Vol. 3,,2023-04-22T00:00:00Z,"comedy film, action film, adventure film, space opera, science fiction film, superhero film, speculative fiction film",James Gunn,150,tt6791350,,54,https://en.wikipedia.org/wiki/Guardians_of_the_Galaxy_Vol._3,2023
The Super Mario Bros. Movie,,2023-04-05T00:00:00Z,"fantasy film, comedy film, adventure film, isekai","Michael Jelenic, Aaron Horvath",92,tt6718170,,53,https://en.wikipedia.org/wiki/The_Super_Mario_Bros._Movie,2023
Indiana Jones and the Dial of Destiny,,2023-05-18T00:00:00Z,"action film, adventure film",James Mangold,154,tt1462764,,52,https://en.wikipedia.org/wiki/Indiana_Jones_and_the_Dial_of_Destiny,2023
Mission: Impossible – Dead Reckoning Part One,,2023-07-12T00:00:00Z,"action film, spy film",Christopher McQuarrie,163,tt9603212,,51,https://en.wikipedia.org/wiki/Mission%3A_Impossible_%E2%80%93_Dead_Reckoning_Part_One,2023
Killers of the Flower Moon,,2023-05-20T00:00:00Z,"drama film, Western film, epic film, crime film, thriller film, crime thriller film, detective film, film based on book, crime drama film",Martin Scorsese,206,tt5537002,,51,https://en.wikipedia.org/wiki/Killers_of_the_Flower_Moon,2023
Ant-Man and the Wasp: Quantumania,,2023-02-15T00:00:00Z,"fantasy film, comedy film, action film, adventure film, science fiction film, thriller film",Peyton Reed,124,tt10954600,,50,https://en.wikipedia.org/wiki/Ant-Man_and_the_Wasp%3A_Quantumania,2023
Fast X,,2023-05-17T00:00:00Z,action film,Louis Leterrier,141,tt5433140,,48,https://en.wikipedia.org/wiki/Fast_X,2023
John Wick: Chapter 4,,2023-03-22T00:00:00Z,"action film, adventure film, crime film, neo-noir, action thriller",Chad Stahelski,169,tt10366206,,48,https://en.wikipedia.org/wiki/John_Wick%3A_Chapter_4,2023
Poor Things,,2023-09-01T00:00:00Z,"black comedy, fantasy film, thriller film, film based on a novel, arthouse science fiction film",Yorgos Lanthimos,141,tt14230458,,48,https://en.wikipedia.org/wiki/Poor_Things,2023
Wish,,2023-11-08T00:00:00Z,"fantasy film, adventure film, musical film, family film, cinematic fairy tale","Chris Buck, Fawn Veerasunthorn",95,tt11304740,,48,https://en.wikipedia.org/wiki/Wish,2023
The Flash,,2023-06-14T00:00:00Z,"drama film, action film, adventure film, science fiction film, superhero film, time-travel film",Andy Muschietti,144,tt0439572,,47,https://en.wikipedia.org/wiki/The_Flash,2023
Dilwale Dulhania Le Jayenge,,2023-03-22T00:00:00Z,"drama film, comedy film, musical film, comedy drama, romance film, coming-of-age fiction",Aditya Chopra,245,tt0112870,,46,https://en.wikipedia.org/wiki/Dilwale_Dulhania_Le_Jayenge,2023
The Marvels,,2023-11-08T00:00:00Z,"action film, adventure film, science fiction film",Nia DaCosta,105,tt10676048,,46,https://en.wikipedia.org/wiki/The_Marvels,2023
Napoleon,,2023-11-22T00:00:00Z,"drama film, adventure film, war film, biographical film, epic film, historical film",Ridley Scott,158,tt13287846,,45,https://en.wikipedia.org/wiki/Napoleon,2023
Puss in Boots: The Last Wish,,2023-01-04T00:00:00Z,"fantasy, fantasy film, comedy film, thriller, action film, animated film, adventure film, musical film, family film, cinematic fairy tale, thriller film",Joel Crawford,100,tt3915174,,45,https://en.wikipedia.org/wiki/Puss_in_Boots%3A_The_Last_Wish,2023
The Boy and the Heron,,2023-10-08T00:00:00Z,"drama film, fantasy film, adventure film",Hayao Miyazaki,124,tt6587046,,43,https://en.wikipedia.org/wiki/The_Boy_and_the_Heron,2023
The Little Mermaid,,2023-05-19T00:00:00Z,"fantasy film, adventure film, musical film, romance film, family film, cinematic fairy tale",Rob Marshall,135,tt5971474,,43,https://en.wikipedia.org/wiki/The_Little_Mermaid,2023
Elemental,,2023-05-27T00:00:00Z,"fantasy film, comedy film, adventure film, science fiction film, romance film, family film",Peter Sohn,102,tt15789038,,43,https://en.wikipedia.org/wiki/Elemental,2023
The Zone of Interest,,2023-05-19T00:00:00Z,"drama film, war film, historical drama, historical film, film based on a novel",Jonathan Glazer,105,tt7160372,,42,https://en.wikipedia.org/wiki/The_Zone_of_Interest,2023
Anatomy of a Fall,,2023-05-21T00:00:00Z,"drama film, crime film, thriller film, trial film",Justine Triet,150,tt17009710,,42,https://en.wikipedia.org/wiki/Anatomy_of_a_Fall,2023
Aquaman and the Lost Kingdom,,2023-12-22T00:00:00Z,"fantasy film, action film, adventure film, science fiction film, superhero film, speculative fiction film",James Wan,124,tt9663764,,41,https://en.wikipedia.org/wiki/Aquaman_and_the_Lost_Kingdom,2023
The Whale,,2023-02-16T00:00:00Z,"drama film, psychological drama film",Darren Aronofsky,117,tt13833688,,41,https://en.wikipedia.org/wiki/The_Whale,2023
Wonka,,2023-12-13T00:00:00Z,"fantasy film, comedy film, adventure film, musical film, speculative fiction film",Paul King,116,tt6166392,,41,https://en.wikipedia.org/wiki/Wonka,2023
Blue Beetle,,2023-08-16T00:00:00Z,"action film, adventure film, superhero film",Angel Manuel Soto,127,tt9362930,,41,https://en.wikipedia.org/wiki/Blue_Beetle,2023
Five Nights at Freddy's,,2023-10-25T00:00:00Z,"horror film, mystery film",Emma Tammi,109,tt4589218,,40,https://en.wikipedia.org/wiki/Five_Nights_at_Freddy%27s,2023
The Banshees of Inisherin,,2023-01-05T00:00:00Z,"black comedy, drama film, comedy film, tragicomedy",Martin McDonagh,114,tt11813216,,40,https://en.wikipedia.org/wiki/The_Banshees_of_Inisherin,2023
Migration,,2023-12-06T00:00:00Z,"comedy film, adventure film, family film",Benjamin Renner,82,tt6495056,,40,https://en.wikipedia.org/wiki/Migration,2023
The Fabelmans,,2023-01-19T00:00:00Z,"drama film, coming-of-age film",Steven Spielberg,151,tt14208870,,39,https://en.wikipedia.org/wiki/The_Fabelmans,2023
Suzume,,2023-04-12T00:00:00Z,"road movie, coming-of-age film, adventure anime, fantasy anime, drama anime",Makoto Shinkai,121,tt16428256,,38,https://en.wikipedia.org/wiki/Suzume,2023
Shazam! Fury of the Gods,,2023-03-14T00:00:00Z,"comedy film, action film, adventure film, superhero film",David F. Sandberg,120,tt10151854,,38,https://en.wikipedia.org/wiki/Shazam%21_Fury_of_the_Gods,2023
The Hunger Games: The Ballad of Songbirds and Snakes,,2023-11-15T00:00:00Z,"drama film, action film, adventure film",Francis Lawrence,158,tt10545296,,38,https://en.wikipedia.org/wiki/The_Hunger_Games%3A_The_Ballad_of_Songbirds_and_Snakes,2023
Babylon,,2023-01-18T00:00:00Z,"drama film, period drama film, historical drama",Damien Chazelle,189,tt10640346,,38,https://en.wikipedia.org/wiki/Babylon,2023
Asteroid City,,2023-05-23T00:00:00Z,"drama film, comedy film, science fiction film, comedy drama, romance film",Wes Anderson,105,tt14230388,,37,https://en.wikipedia.org/wiki/Asteroid_City,2023
Scream VI,,2023-03-08T00:00:00Z,"slasher film, comedy horror film","Matt Bettinelli-Olpin, Tyler Gillett",118,tt17663992,,37,https://en.wikipedia.org/wiki/Scream_VI,2023
The Creator,,2023-09-26T00:00:00Z,"drama film, science fiction film, post-apocalyptic film, dystopian film, science fiction action film",Gareth Edwards,133,tt11858890,,36,https://en.wikipedia.org/wiki/The_Creator,2023
M3GAN,,2023-01-06T00:00:00Z,"horror film, science fiction film, thriller film, comedy horror film",Gerard Johnstone,102,tt8760708,,36,https://en.wikipedia.org/wiki/M3GAN,2023
The Holdovers,,2023-10-27T00:00:00Z,"comedy drama, Christmas film",Alexander Payne,133,tt14849194,,36,https://en.wikipedia.org/wiki/The_Holdovers,2023
Transformers: Rise of the Beasts,,2023-06-07T00:00:00Z,"action film, adventure film, science fiction film",Steven Caple Jr.,127,tt5090568,,35,https://en.wikipedia.org/wiki/Transformers%3A_Rise_of_the_Beasts,2023
The Nun II,,2023-09-07T00:00:00Z,"Satanic film, supernatural horror film",Michael Chaves,109,tt10160976,,35,https://en.wikipedia.org/wiki/The_Nun_II,2023
Winnie-the-Pooh: Blood and Honey,,2023-01-01T00:00:00Z,"horror film, slasher film, Horror based on children's characters",Rhys Frake-Waterfield,84,tt19623240,,35,https://en.wikipedia.org/wiki/Winnie-the-Pooh%3A_Blood_and_Honey,2023
Past Lives,,2023-06-09T00:00:00Z,drama film,Celine Song,106,tt13238346,,35,https://en.wikipedia.org/wiki/Past_Lives,2023
20 Days in Mariupol,,2023-01-20T00:00:00Z,"documentary film, war film",Mstyslav Chernov,95,tt24082438,,35,https://en.wikipedia.org/wiki/20_Days_in_Mariupol,2023
The City of Lost Children,,2023-10-05T00:00:00Z,"fantasy film, science fiction film, dystopian film, steampunk film, arthouse science fiction film","Jean-Pierre Jeunet, Marc Caro",112,tt0112682,,34,https://en.wikipedia.org/wiki/The_City_of_Lost_Children,2023
Dungeons & Dragons: Honor Among Thieves,,2023-03-10T00:00:00Z,"fantasy film, comedy film, adventure film, speculative fiction film, sword and sorcery film","John Francis Daley, Jonathan Goldstein",108,tt2906216,,34,https://en.wikipedia.org/wiki/Dungeons_%26_Dragons%3A_Honor_Among_Thieves,2023
Tár,,2023-02-16T00:00:00Z,"drama film, musical film, LGBT-related film, psychological film",Todd Field,158,tt14444726,,34,https://en.wikipedia.org/wiki/T%C3%A1r,2023
Meg 2: The Trench,,2023-08-02T00:00:00Z,"action film, horror film, adventure film, science fiction film, kaiju, thriller film, film based on a novel",Ben Wheatley,116,tt9224104,,34,https://en.wikipedia.org/wiki/Meg_2%3A_The_Trench,2023
Society of the Snow,,2023-09-09T00:00:00Z,"drama film, adventure film, biographical film, thriller film, historical film",J. A. Bayona,144,tt16277242,,34,https://en.wikipedia.org/wiki/Society_of_the_Snow,2023
"Red, White & Royal Blue",,2023-08-11T00:00:00Z,"comedy film, romance film",Matthew López,112,tt10172266,,33,https://en.wikipedia.org/wiki/Red%2C_White_%26_Royal_Blue,2023
A Man Called Otto,,2023-01-06T00:00:00Z,"drama film, comedy film, film based on a novel",Marc Forster,126,tt7405458,,33,https://en.wikipedia.org/wiki/A_Man_Called_Otto,2023
No Hard Feelings,,2023-06-21T00:00:00Z,"comedy film, comedy drama, romantic comedy",Gene Stupnitsky,90,tt15671028,,33,https://en.wikipedia.org/wiki/No_Hard_Feelings,2023
Sound of Freedom,,2023-07-04T00:00:00Z,"drama film, action film, crime film",Alejandro Monteverde,131,tt7599146,,32,https://en.wikipedia.org/wiki/Sound_of_Freedom,2023
Cocaine Bear,,2023-02-23T00:00:00Z,"action film, police film, thriller film, black comedy film",Elizabeth Banks,95,tt14209916,,32,https://en.wikipedia.org/wiki/Cocaine_Bear,2023
Evil Dead Rise,,2023-03-15T00:00:00Z,"horror film, speculative fiction film, supernatural horror film",Lee Cronin,96,tt13345606,,32,https://en.wikipedia.org/wiki/Evil_Dead_Rise,2023
Maestro,,2023-09-02T00:00:00Z,"drama film, biographical film, romance film, LGBT-related film",Bradley Cooper,129,tt5535276,,32,https://en.wikipedia.org/wiki/Maestro,2023
A Haunting in Venice,,2023-09-13T00:00:00Z,"crime film, mystery film, police film, neo-noir, thriller film, detective film, film based on a novel, drama film",Kenneth Branagh,103,tt22687790,,32,https://en.wikipedia.org/wiki/A_Haunting_in_Venice,2023
Demon Slayer: Kimetsu no Yaiba the Movie: Mugen Train,,2023-01-25T00:00:00Z,"action film, dark fantasy, anime film",Haruo Sotozaki,117,tt11032374,,31,https://en.wikipedia.org/wiki/Demon_Slayer%3A_Kimetsu_no_Yaiba_the_Movie%3A_Mugen_Train,2023
The Killer,,2023-09-03T00:00:00Z,"neo-noir, action thriller, film based on literature",David Fincher,118,tt1136617,,31,https://en.wikipedia.org/wiki/The_Killer,2023
Air,,2023-03-18T00:00:00Z,"drama film, biographical film",Ben Affleck,112,tt16419074,,31,https://en.wikipedia.org/wiki/Air,2023
Saw X,,2023-09-28T00:00:00Z,"drama film, horror film, crime film, mystery film, thriller film",Kevin Greutert,118,tt21807222,,31,https://en.wikipedia.org/wiki/Saw_X,2023
American Fiction,,2023-09-08T00:00:00Z,"drama film, film based on a novel",Cord Jefferson,117,tt23561236,,31,https://en.wikipedia.org/wiki/American_Fiction,2023
"Ruby Gillman, Teenage Kraken",,2023-06-28T00:00:00Z,"comedy film, action film, adventure film, family film, children's film, speculative fiction film",Kirk DeMicco,90,tt27155038,,31,https://en.wikipedia.org/wiki/Ruby_Gillman%2C_Teenage_Kraken,2023
Operation Fortune: Ruse de guerre,,2023-01-05T00:00:00Z,"action film, spy film, thriller film, action comedy film",Guy Ritchie,114,tt7985704,,30,https://en.wikipedia.org/wiki/Operation_Fortune%3A_Ruse_de_guerre,2023
Expend4bles,,2023-09-21T00:00:00Z,"action film, war film, thriller film",Scott Waugh,103,tt3291150,,30,https://en.wikipedia.org/wiki/Expend4bles,2023
Teenage Mutant Ninja Turtles: Mutant Mayhem,,2023-09-07T00:00:00Z,"ninja film, comedy film, action film, animated film, adventure film, superhero film",Jeff Rowe,99,tt8589698,,30,https://en.wikipedia.org/wiki/Teenage_Mutant_Ninja_Turtles%3A_Mutant_Mayhem,2023
Knock at the Cabin,,2023-02-02T00:00:00Z,"horror film, science fiction film, post-apocalyptic film, thriller film, film based on book",M. Night Shyamalan,100,tt15679400,,30,https://en.wikipedia.org/wiki/Knock_at_the_Cabin,2023
Creed III,,2023-03-01T00:00:00Z,"drama film, boxing film",Michael B. Jordan,116,tt11145118,,30,https://en.wikipedia.org/wiki/Creed_III,2023
May December,,2023-05-20T00:00:00Z,"drama film, romance film",Todd Haynes,113,tt13651794,,30,https://en.wikipedia.org/wiki/May_December,2023
Nimona,,2023-06-23T00:00:00Z,"fantasy film, comedy film, action film, adventure film, science fiction film, family film, LGBT-related film","Troy Quane, Nick Bruno",102,tt19500164,,30,https://en.wikipedia.org/wiki/Nimona,2023
Peter Pan & Wendy,,2023-04-28T00:00:00Z,"fantasy film, action film, adventure film, romance film, family film, cinematic fairy tale, thriller film",David Lowery,106,tt5635026,,29,https://en.wikipedia.org/wiki/Peter_Pan_%26_Wendy,2023
65,,2023-03-09T00:00:00Z,"adventure film, science fiction film, thriller film, survival film","Bryan Woods, Scott Beck",93,tt12261776,,29,https://en.wikipedia.org/wiki/65,2023
Beau Is Afraid,,2023-04-20T00:00:00Z,"drama film, comedy film, adventure film, comedy horror film",Ari Aster,179,tt13521006,,29,https://en.wikipedia.org/wiki/Beau_Is_Afraid,2023
Aftersun,,2023-03-09T00:00:00Z,"drama film, teen drama film",Charlotte Wells,101,tt19770238,,29,https://en.wikipedia.org/wiki/Aftersun,2023
Saltburn,,2023-11-17T00:00:00Z,"drama film, thriller film, black comedy film",Emerald Fennell,131,tt17351924,,29,https://en.wikipedia.org/wiki/Saltburn,2023
Priscilla,,2023-09-04T00:00:00Z,"drama film, biographical film, film based on book",Sofia Coppola,113,tt22041854,,29,https://en.wikipedia.org/wiki/Priscilla,2023
The Pope's Exorcist,,2023-04-06T00:00:00Z,"horror film, biographical film, speculative fiction film, supernatural horror film",Julius Avery,103,tt13375076,,29,https://en.wikipedia.org/wiki/The_Pope%27s_Exorcist,2023
Talk to Me,,2023-07-27T00:00:00Z,"horror film, thriller film","Danny Philippou, Michael Philippou",94,tt10638522,,29,https://en.wikipedia.org/wiki/Talk_to_Me,2023
Perfect Days,,2023-05-25T00:00:00Z,"drama film, slice of life",Wim Wenders,123,tt27503384,,29,https://en.wikipedia.org/wiki/Perfect_Days,2023
The Exorcist: Believer,,2023-10-04T00:00:00Z,"horror film, Satanic film",David Gordon Green,121,tt12921446,,28,https://en.wikipedia.org/wiki/The_Exorcist%3A_Believer,2023
Plane,,2023-01-13T00:00:00Z,"action film, adventure film, action thriller",Jean-François Richet,107,tt5884796,,28,https://en.wikipedia.org/wiki/Plane,2023
Trolls Band Together,,2023-10-18T00:00:00Z,"comedy film, musical film",Walt Dohrn,92,tt14362112,,28,https://en.wikipedia.org/wiki/Trolls_Band_Together,2023
The Pale Blue Eye,,2023-01-06T00:00:00Z,"horror film, crime film, mystery film, police film, thriller film, gothic film, film based on a novel",Scott Cooper,128,tt14138650,,27,https://en.wikipedia.org/wiki/The_Pale_Blue_Eye,2023
Close,,2023-01-27T00:00:00Z,drama film,Lukas Dhont,105,tt9660502,,27,https://en.wikipedia.org/wiki/Close,2023
The Woman King,,2023-02-02T00:00:00Z,"drama film, action film, epic film, historical film",Gina Prince-Bythewood,135,tt8093700,,27,https://en.wikipedia.org/wiki/The_Woman_King,2023
Renfield,,2023-03-30T00:00:00Z,"comedy horror, vampire film, comedy horror film",Chris McKay,93,tt11358390,,27,https://en.wikipedia.org/wiki/Renfield,2023
Holy Spider,,2023-01-12T00:00:00Z,crime film,Ali Abbasi,117,tt18550140,,27,https://en.wikipedia.org/wiki/Holy_Spider,2023
Gran Turismo,,2023-08-09T00:00:00Z,"drama film, action film, biographical film, sport film",Neill Blomkamp,134,tt4495098,,27,https://en.wikipedia.org/wiki/Gran_Turismo,2023
Fallen Leaves,,2023-05-22T00:00:00Z,"drama film, comedy film, romance film",Aki Kaurismäki,81,tt21027780,,27,https://en.wikipedia.org/wiki/Fallen_Leaves,2023
The Equalizer 3,,2023-08-31T00:00:00Z,"drama film, action film, crime film, thriller film, vigilante film",Antoine Fuqua,109,tt17024450,,27,https://en.wikipedia.org/wiki/The_Equalizer_3,2023
The Last Waltz,,2023-04-27T00:00:00Z,"concert film, music documentary film",Martin Scorsese,115,tt0077838,,26,https://en.wikipedia.org/wiki/The_Last_Waltz,2023
Leave the World Behind,,2023-12-08T00:00:00Z,"post-apocalyptic film, psychological thriller film",Sam Esmail,138,tt12747748,,26,https://en.wikipedia.org/wiki/Leave_the_World_Behind,2023
Heart of Stone,,2023-08-11T00:00:00Z,"action film, spy film, thriller film",Tom Harper,122,tt13603966,,26,https://en.wikipedia.org/wiki/Heart_of_Stone,2023
One Life,,2023-09-09T00:00:00Z,"drama film, biographical film, historical film",James Hawes,109,tt13097932,,26,https://en.wikipedia.org/wiki/One_Life,2023
Ferrari,,2023-01-01T00:00:00Z,"drama film, biographical film, film based on book",Michael Mann,130,tt3758542,,26,https://en.wikipedia.org/wiki/Ferrari,2023
Anyone but You,,2023-12-22T00:00:00Z,romantic comedy,Q2576503,103,tt26047818,,26,https://en.wikipedia.org/wiki/Anyone_but_You,2023
The Wonderful Story of Henry Sugar,,2023-09-27T00:00:00Z,"drama film, comedy film, adventure film",Wes Anderson,37,tt16968450,,26,https://en.wikipedia.org/wiki/The_Wonderful_Story_of_Henry_Sugar,2023
Asterix & Obelix: The Middle Kingdom,,2023-02-01T00:00:00Z,"comedy film, adventure film, family film",Guillaume Canet,111,tt11210390,,25,https://en.wikipedia.org/wiki/Asterix_%26_Obelix%3A_The_Middle_Kingdom,2023
The Challenge,,2023-04-12T00:00:00Z,"drama film, docudrama",Klim Shipenko,165,tt14812496,,25,https://en.wikipedia.org/wiki/The_Challenge,2023
Extraction 2,,2023-06-13T00:00:00Z,"action film, thriller film",Sam Hargrave,122,tt12263384,,25,https://en.wikipedia.org/wiki/Extraction_2,2023
Guy Ritchie's The Covenant,,2023-04-21T00:00:00Z,"drama film, action film, war film, thriller film",Guy Ritchie,123,tt4873118,,25,https://en.wikipedia.org/wiki/Guy_Ritchie%27s_The_Covenant,2023
Rebel Moon — Part One: A Child of Fire,,2023-12-15T00:00:00Z,"adventure film, science fiction film, epic film",Zack Snyder,135,tt14998742,,25,https://en.wikipedia.org/wiki/Rebel_Moon_%E2%80%94_Part_One%3A_A_Child_of_Fire,2023
Godzilla Minus One,,2023-11-01T00:00:00Z,"drama film, action film, horror film, adventure film, science fiction film, Japanese mythology, disaster film, kaiju, monster film, thriller film",Takashi Yamazaki,125,tt23289160,,25,https://en.wikipedia.org/wiki/Godzilla_Minus_One,2023
Pathaan,,2023-01-25T00:00:00Z,"action film, adventure film, spy film, thriller film",Siddharth Anand,146,tt12844910,,25,https://en.wikipedia.org/wiki/Pathaan,2023
Insidious: The Red Door,,2023-07-05T00:00:00Z,"horror film, speculative fiction film, supernatural horror film",Patrick Wilson,107,tt13405778,,25,https://en.wikipedia.org/wiki/Insidious%3A_The_Red_Door,2023
Monster,,2023-05-17T00:00:00Z,"drama film, thriller film, LGBT-related film, coming-of-age film",Hirokazu Koreeda,127,tt23736044,,25,https://en.wikipedia.org/wiki/Monster,2023
Tetris,,2023-03-15T00:00:00Z,"biographical film, thriller film",Jon S. Baird,118,tt12758060,,24,https://en.wikipedia.org/wiki/Tetris,2023
The Taste of Things,,2023-05-24T00:00:00Z,"drama film, romance film, historical film",Trần Anh Hùng,134,tt19760052,,24,https://en.wikipedia.org/wiki/The_Taste_of_Things,2023
The Color Purple,,2023-12-25T00:00:00Z,"drama film, musical film, historical film, coming-of-age film",Blitz the Ambassador,,tt1200263,,24,https://en.wikipedia.org/wiki/The_Color_Purple,2023
Nyad,,2023-01-01T00:00:00Z,biographical sports film,"Elizabeth Chai Vasarhelyi, Jimmy Chin",121,tt5302918,,24,https://en.wikipedia.org/wiki/Nyad,2023
Thanksgiving,,2023-11-17T00:00:00Z,"horror film, slasher film",Eli Roth,106,tt1448754,,24,https://en.wikipedia.org/wiki/Thanksgiving,2023
Mavka: The Forest Song,,2023-03-02T00:00:00Z,"fantasy film, comedy film, adventure film, musical film, family film, speculative fiction film","Oleksandra Ruban, Oleh Malamuzh",99,tt6685538,,24,https://en.wikipedia.org/wiki/Mavka%3A_The_Forest_Song,2023
Missing,,2023-01-19T00:00:00Z,"drama film, mystery film, thriller film, screenlife","Will Merrick, Nicholas D. Johnson",111,tt10855768,,23,https://en.wikipedia.org/wiki/Missing,2023
The Three Musketeers: D'Artagnan,,2023-04-05T00:00:00Z,"swashbuckler film, adventure film, historical film, film based on a novel",Martin Bourboulon,121,tt12672536,,23,https://en.wikipedia.org/wiki/The_Three_Musketeers%3A_D%27Artagnan,2023
Haunted Mansion,,2023-07-27T00:00:00Z,"comedy horror, speculative fiction film",Justin Simien,122,tt1695843,,23,https://en.wikipedia.org/wiki/Haunted_Mansion,2023
Women Talking,,2023-01-06T00:00:00Z,"drama film, film based on book",Sarah Polley,104,tt13669038,,23,https://en.wikipedia.org/wiki/Women_Talking,2023
Infinity Pool,,2023-01-21T00:00:00Z,"horror film, science fiction film, mystery film",Brandon Cronenberg,117,tt10365998,,23,https://en.wikipedia.org/wiki/Infinity_Pool,2023
EO,,2023-02-21T00:00:00Z,"drama film, road movie",Jerzy Skolimowski,86,tt19652910,,23,https://en.wikipedia.org/wiki/EO,2023
Pearl,,2023-04-09T00:00:00Z,"psychological horror, slasher film",Ti West,102,tt18925334,,23,https://en.wikipedia.org/wiki/Pearl,2023
Ghosted,,2023-04-21T00:00:00Z,"action film, romantic comedy, romance film, action-adventure film",Dexter Fletcher,116,tt15326988,,23,https://en.wikipedia.org/wiki/Ghosted,2023
Strays,,2023-08-17T00:00:00Z,"comedy film, adventure film",Josh Greenbaum,93,tt15153532,,23,https://en.wikipedia.org/wiki/Strays,2023
Hit Man,,2023-09-05T00:00:00Z,"black comedy, thriller film, action comedy film, black comedy film",Richard Linklater,115,tt20215968,,23,https://en.wikipedia.org/wiki/Hit_Man,2023
The Iron Claw,,2023-11-08T00:00:00Z,"drama film, biographical film, sport film",Sean Durkin,132,tt21064584,,23,https://en.wikipedia.org/wiki/The_Iron_Claw,2023
La chimera,,2023-05-26T00:00:00Z,"fantasy film, adventure film, comedy drama",Alice Rohrwacher,130,tt14561712,,23,https://en.wikipedia.org/wiki/La_chimera,2023
All of Us Strangers,,2023-08-31T00:00:00Z,"fantasy film, romance film",Andrew Haigh,105,tt21192142,,23,https://en.wikipedia.org/wiki/All_of_Us_Strangers,2023
Dumb Money,,2023-01-01T00:00:00Z,"drama film, comedy film, biographical film, comedy drama, film based on book",Craig Gillespie,105,tt13957560,,23,https://en.wikipedia.org/wiki/Dumb_Money,2023
Io capitano,,2023-09-06T00:00:00Z,"drama film, adventure film, docudrama",Matteo Garrone,121,tt14225838,,23,https://en.wikipedia.org/wiki/Io_capitano,2023
Once Upon a Studio,,2023-06-11T00:00:00Z,"crossover fiction, live-action/animated film, fantasy comedy film","Dan Abraham, Trent Correy",9,tt28035641,,23,https://en.wikipedia.org/wiki/Once_Upon_a_Studio,2023
Ladybug & Cat Noir: The Movie,,2023-07-05T00:00:00Z,"drama film, fantasy film, comedy film, action film, adventure film, musical film, family film, superhero film",Jeremy Zag,105,tt10364034,,23,https://en.wikipedia.org/wiki/Ladybug_%26_Cat_Noir%3A_The_Movie,2023
Chicken Run: Dawn of the Nugget,,2023-12-08T00:00:00Z,"comedy film, adventure film, family film",Sam Fell,97,tt8337264,,23,https://en.wikipedia.org/wiki/Chicken_Run%3A_Dawn_of_the_Nugget,2023
One Piece Film: Red,,2023-01-26T00:00:00Z,"fantasy film, comedy film, action film, adventure film",Gorō Taniguchi,115,tt16183464,,22,https://en.wikipedia.org/wiki/One_Piece_Film%3A_Red,2023
Terrifier 2,,2023-02-21T00:00:00Z,"horror film, slasher film",Pepe,138,tt10403420,,22,https://en.wikipedia.org/wiki/Terrifier_2,2023
Decision to Leave,,2023-02-02T00:00:00Z,"drama film, romance film, mystery film, police film",Park Chan-wook,138,tt12477480,,22,https://en.wikipedia.org/wiki/Decision_to_Leave,2023
The Mother,,2023-01-01T00:00:00Z,"drama film, action film, thriller film",Niki Caro,115,tt6968614,,22,https://en.wikipedia.org/wiki/The_Mother,2023
Golda,,2023-02-20T00:00:00Z,"drama film, biographical film",Guy Nattiv,100,tt14454876,,22,https://en.wikipedia.org/wiki/Golda,2023
